{
  "advantageClass": "standard_win",
  "axes": {
    "compression": {
      "deltaStandardMinusEml": -6,
      "emlOperatorCount": 10,
      "label": "standard_smaller_surface",
      "standardOperatorCount": 4
    },
    "lowering": {
      "label": "lower_to_standard",
      "recommendation": "use_standard"
    },
    "proof": {
      "compilerCorrectnessProved": false,
      "compilerSkeletonOpenObligations": 5,
      "label": "proof_obligations_open",
      "scopedSemanticCertificate": false
    },
    "runtime": {
      "deltaStandardMinusEmlNs": 5.07080078125,
      "emlLatencyNsPerSample": 6.7890625,
      "label": "eml_faster_local",
      "runtimeBakeoffStatus": "pass",
      "standardLatencyNsPerSample": 11.85986328125
    },
    "search": {
      "included": false,
      "label": "not_a_search_fixture"
    },
    "stability": {
      "emlFiniteRatio": 1.0,
      "emlMaxRelError": 3.494354962375931e-16,
      "finiteDeltaEmlMinusStandard": 0.0,
      "label": "standard_more_stable",
      "relativeErrorDeltaStandardMinusEml": -3.494354962375931e-16,
      "standardFiniteRatio": 1.0,
      "standardMaxRelError": 0.0
    },
    "teaching": {
      "label": "standard_runtime_clarity",
      "summary": "The standard form is clearer for implementation under the current evidence."
    }
  },
  "blockedClaims": [
    "No general EML superiority claim.",
    "No public performance or savings claim.",
    "No compiler correctness claim.",
    "No theorem discovery claim.",
    "No claim that EML wins on this case."
  ],
  "caseId": "sigmoid_derivative_v0",
  "claimFlags": {
    "certified_safety_claim": false,
    "compiler_behavior_changed": false,
    "compiler_correctness_claim": false,
    "deploy_performed": false,
    "eml_general_superiority_claim": false,
    "forge_behavior_changed": false,
    "formal_proof_claim": false,
    "formal_verification_claim": false,
    "hardware_measurement_claim": false,
    "hardware_observed": false,
    "live_serial_capture_performed": false,
    "production_controller_claim": false,
    "public_performance_claim": false,
    "public_ready": false,
    "public_savings_claim": false,
    "rh_proof_claim": false,
    "theorem_discovery_claim": false,
    "theorem_proof_claim": false,
    "zeta_zero_discovery_claim": false
  },
  "date": "2026-05-27",
  "emlForm": "(1 / (1 + exp(-x))) * (1 - (1 / (1 + exp(-x))))",
  "evidencePaths": [
    "reports/eml_r10_cost_stability_lab_2026_05_27.md",
    "reports/eml_r10b_runtime_bakeoff_2026_05_27.md",
    "reports/eml_r10c_scoped_semantic_proof_2026_05_27.md",
    "reports/eml_r10e_formal_compiler_proof_skeleton_2026_05_27.md"
  ],
  "family": "sigmoid_logistic",
  "nonClaims": [
    "The EML Advantage Lab is a bounded comparison surface, not a proof system.",
    "It does not claim EML is generally superior to standard mathematics.",
    "It does not claim compiler correctness, theorem discovery, RH proof, zeta-zero discovery, hardware measurement, or public performance.",
    "Each advantage class is local to the listed evidence and fixture."
  ],
  "packetType": "eml_advantage_packet_v0",
  "schemaVersion": "monogate.eml_advantage_packet.v0",
  "standardForm": "stable_sigmoid(x) * (1 - stable_sigmoid(x))"
}
